<?xml version="1.0" encoding="UTF-8"?>
<xs:schema xmlns:xs="http://www.w3.org/2001/XMLSchema">
  <xs:element name="concesionario" type="tipoConcesionario"/>
  <xs:complexType name="tipoConcesionario">
    <xs:sequence>
      <xs:element name="modeloCoche" type="tipoModeloCoche" maxOccurs="unbounded"/>
    </xs:sequence>
  </xs:complexType>

  <!--ELEMENTOS MODELO COCHE -->
  <xs:complexType name="tipoModeloCoche" mixed="true">
    <xs:sequence>
      <xs:element name="modeloMotor" minOccurs="0" maxOccurs="1">
        <xs:complexType>
          <xs:attribute name="idModeloCoche" type="xs:IDREFS" use="required"/>
        </xs:complexType>
      </xs:element>
    </xs:sequence>
    <xs:attribute name="idModeloCoche" type="tipoIdCoche" use="required"/> 
    <xs:attribute name="idsRefModeloCoche" type="xs:IDREFS" use="optional"/>
  </xs:complexType>
<!-- ID DEBE CONTENER 2 LETRAS Y 3 NUM -->
  <xs:simpleType name="tipoIdCoche">
    <xs:restriction base="xs:ID">
      <xs:pattern value="[a-z]{2}[0-9]{3}"></xs:pattern>
    </xs:restriction>
  </xs:simpleType>

</xs:schema>
